{
  "$schema": "http://json-schema.org/draft-04/schema#",
  "type": "object",
  "required": [ "meetings", "services", "events", "toys", "links" ],
  "properties": {
    "meetings": {
      "type": "array",
      "minItems": 1,
      "items": {
        "type": "object",
        "required": [ "name", "location", "day", "time" ],
        "properties": {
          "name": { "type": "string" },
          "location": { "type": "string" },
          "day": { "type": "string" },
          "time": { "$ref": "#/definitions/hmTime" }
        }
      }
    },
    "services": {
      "type": "array",
      "minItems": 1,
      "items": { "type": "string" }
    },
    "events": {
      "type": "array",
      "minItems": 1,
      "items": {
        "type": "object",
        "required": [ "name", "blurb", "when" ],
        "properties": {
          "name": { "type": "string" },
          "blurb": { "type": "string" },
          "when": { "type": "string" }
        }
      }
    },
    "toys": {
      "type": "array",
      "minItems": 1,
      "items": {
        "type": "object",
        "required": [ "name", "blurb" ],
        "properties": {
          "name": { "type": "string" },
          "blurb": { "type": "string" }
        }
      }
    },
    "links": {
      "type": "array",
      "minItems": 1,
      "items": { "type": "string" }
    }
  },
  "definitions": {
    "isoDate": {
      "type": "string",
      "pattern": "^[0-9]{4}-[0-1][0-9]-[0-3][0-9]$"
    },
    "hmTime": {
      "type": "string",
      "pattern": "^[0-2][0-9]:[0-5][0-9]$"
    },
    "url": {
      "type": "string",
      "pattern": "(https?|ftp)://([^\\s/?\\.#-]+\\.?)+(/[^\\s]*)?"
    },
    "unixFile": {
      "type": "string",
      "pattern": "(/[^\\s]+)*[^\\s]*(.[^\\s]*)*.?[^\\s]+"
    }
  }
}
