{
  "meetings" : [
    {
      "name" : "Machine Room",
      "location" : "Cyert B6",
      "day" : "Saturday",
      "time" : "17:00"
    },
    {
      "name" : "Admin Mtg",
      "location" : "Wean 5304",
      "day" : "Tuesday",
      "time" : "17:00"
    }
  ],
  "services" : [
    "Contributed Webserver",
    "OpenVMS Cluster",
    "Open Source Project Mirrors",
    "Realtime Graphics Demos",
    "Open-Access Virtual Machines",
    "Jabber Chat Server"
  ],
  "events" : [
    {
      "name" : "Demosplash",
      "blurb" : "The largest demoparty on the East Coast",
      "when" : "Nov 4-5"
    },
    {
      "name" : "Retro Gaming Night",
      "blurb" : "Classic games on original hardware",
      "when" : "Spring"
    },
    {
      "name" : "Talk Series",
      "blurb" : "Unlock the full power of your system",
      "when" : "All Year"
    }
  ],
  "toys" : [
    {
      "name" : "Shell Machines",
      "blurb" : "Less crowded than Andrew and no nightly reboots."
    },
    {
      "name" : "Unusual Hardware",
      "blurb" : "Ancient, modern, or just plain weird?  We have it."
    },
    {
      "name" : "Virtual Machines",
      "blurb" : "Why pay someone else to host your code?"
    }
  ],
  "links" : [
    "cmucc.org",
    "twitter.com/cl0x",
    "facebook.com/cmucclub",
    "irc://freenode.net/##cclub"
  ]
}
