{
  "meetings" : [
    {
      "name" : "Machine Room",
      "location" : "Cyert B6",
      "day" : "Saturday",
      "time" : "17:00"
    },
    {
      "name" : "Admin Mtg",
      "location" : "Porter A19C",
      "day" : "Tuesday",
      "time" : "17:30"
    }
  ],
  "services" : [
    "Contributed Webserver",
    "OpenVMS Cluster",
    "Open Source Project Mirrors",
    "Realtime Graphics Demos",
    "Freenode IRC Server",
    "Jabber &amp; Zephyr Chat Servers"
  ],
  "events" : [
    {
      "name" : "Demosplash",
      "blurb" : "North America's largest Fall demoparty",
      "when" : "October"
    },
    {
      "name" : "Retro Gaming Night",
      "blurb" : "Classic games on original hardware",
      "when" : "Spring"
    },
    {
      "name" : "Talk Series",
      "blurb" : "Unlock the full power of your systems",
      "when" : "All Year"
    }
  ],
  "toys" : [
    {
      "name" : "Shell Machines",
      "blurb" : "Less crowded than Andrew and no nightly reboots."
    },
    {
      "name" : "Club AFS",
      "blurb" : "More space and faster access than Andrew AFS."
    },
    {
      "name" : "Virtual Machines",
      "blurb" : "Why pay someone else to host your code?"
    }
  ],
  "links" : [
    "cmucc.org",
    "twitter.com/cl0x",
    "facebook.com/cmucclub",
    "irc://freenode.net/##cclub"
  ]
}
